상호,설명,업소정보,리뷰
기소야,한때 장안의 화제가 될 정도로 많은 분점을 거느리고 있기도 했던 기소야는 역시 삼성동 본점의 맛이 최고이다. 다른 분점과는 다른 독특한 분위기가 살아 있다. 일식 우동에 김치나 고춧가루 등의 한국적인 맛을 절묘하게 조화시켰다. 다양한 종류의 정식이 있으며 모두 우동이 곁들여진다.,"{'전화번호': '02-554-7077', '웹사이트': 'http://www.kisoya.co.kr/', '이용시간': '매일 11:00~20:30', '휴무일': '명절 휴무', '이용요금': '약 1 ~ 2만원대', '대표메뉴': '김치우동정식, 돈까스자루소바, 가쯔나베정식', '주소': '06168  서울 강남구 삼성로92길 13 (삼성동)', '교통 정보': '2호선 삼성역 5번 출구에서 약 485m (도보 8분)'}","[{'review': '어릴적부터 가족 외식으로 자주 방문한 기소야의 본점입니다. 개인적으로 모두 만족스러웠습니다. 가격은 메뉴에 따라 7000원(단품)에서 15000원(세트) 정도로 생각하면 됩니다. 그리고 간이 다소 진하다 느낄 수도 있습니다. 다만 화장실에서의 악취는 유일하게 아쉬운 점이었습니다.', 'score': '5'}, {'review': '아주 오래전에 이곳이 기소야 본점이자 당시엔 우리나라에 별로 없었던 정통 일본식 일본 우동집이라 멀리서도 먹으러 오곤했는데 지금이 여기저기 많이 생기기도 했지만 프렌차이지를 늘리면서 왠지 공장맛이 나는거 같아 회사 앞인데도 잘오지 않는다. 이곳에서 일본 사람을 본적이 요즘 없는거 같은데 그건 바로 이 집의 현 상황이라고 생각한다.', 'score': '3'}, {'review': '돈까스 정식먹음 이미 만원은 훌쩍 넘지만 그래도 깔끔 하고 맛있습니다 나베류나 모밀 다른 음식도 있어요', 'score': '4'}, {'review': '기소야 본점도 있지만 코엑스 지점도 괜찮습니다. 김치우동정식, 가츠나베정식, 김치 치즈 나베, 생선구이, 초밥등 메뉴가 다양하고 저녁때는 술드시는 분들도 많습니다. 가끔 생선구이등 그날의 메뉴로 세일을 하더라구요.', 'score': '4'}, {'review': '돈까스, 우동, 모밀국수가 주요 메뉴입니다. 가격이 아주 저렴하진 않지만 메뉴가 전반적으로 맛있어서 언제든 먹기 무난합니다. 특히 국물이 자작하게 나오는 가츠나베정식이 맛있습니다.', 'score': '5'}]"
타코아미고,"저렴한 가격의 멕시칸 음식 전문점. 야채, 닭가슴살, 비프, 치즈 등 다양한 종류의 타코, 화히타 등을 맛볼 수 있다. 2천2백 원을 추가하면 라이스, 빈, 나초를 즐길 수 있는 세트도 있다.","{'전화번호': '02-749-5253', '이용시간': '월 16:00 ~ 22:30 / 화~목,일 11:30 ~ 22:30 / 금~토  11:30 ~ 23:30', '운영 요일': '매일', '대표메뉴': '타말레, 타코도라도, 께사디아, 파히타', '주소': '04391  서울 용산구 보광로 123', '교통 정보': '6호선 이태원역 4번 출구'}","[{'review': '타코 정말 좋아하거든요\n멕시코 특유의 타코 소스와 나초와 또띠아의 조합은\n항상 옳아요 \n소스가 흥건하게 올라가서 마음에 들어요', 'score': '4'}, {'review': '타코 요리집인데 9천원~1만원 초반대까지도 단품으로 꽤 괜찮아요. 여기가 오리지널 느낌? 채식주의자들이 와도 되는 그런 집이에요. 신선하고 맛있어서 또 생각나고 건물 자체를 리모델링해서 아주 깔끔해졌어요.', 'score': '4'}, {'review': '작고 아담하여 조금 불편 할 수는 있지만 무늬만 타코가 아니 진정한 타코의 맛을 보여주는 집입니다. 가정식 분위기의 음식은 정감있으며 맛 품질 다 좋습니다. 외국인들도 많이 찾아오는 집이여서 언제나 붐비더군요.', 'score': '5'}, {'review': '장점:  타고의 맛은 서울 최고인듯\n         신선한 야채와 고기의 식감이 좋다\n         저렴하다(타고2피스에 8천원정도)\n\n단점: 서비스가 친절하지 않다(불친절하지도 않지만)\n         2차선 도로옆에 있는 곳으로, 분위기가 어수선\n\n건너편에 타코벨이 있지만, 진짜 타코맛을 즐기러 오는 고객이 많습니다\n저도 그중 한명!\n간다면...', 'score': '5'}, {'review': '가게문이 활짝 열려있어 테이블과 의자의 청결상태는 좋지 않았지만 물티슈를 제공해주었고, 맛은 기대 이상. 옆테이블에서 머리카락이 나왔는데 응대가 미흡했던 점은 마이너스. 맛은 있었지만 먹기에 더 쾌적한 환경이었다면 어땠을지 아쉬운점.', 'score': '5'}]"
장사랑,"가야금 산조를 들으면서 곤드레 솥밥, 묵사발, 들깨 수제비 등을 맛볼 수 있는 곳이다. 곤드레 솥밥은 주문하면 밥을 짓기 시작하므로 시간이 좀 걸리는 것을 고려하여야 한다. 묵사발과 바싹불고기가 특히 인기있으며, 검은콩 막걸리도 이 집만의 특색 있는 메뉴이다.","{'전화번호': '02-546-9994', '이용시간': '매일 11:00 ~ 16:00 / 17:00 ~ 21:00', '휴무일': '명절 휴무', '대표메뉴': '곤드레솥밥,바싹불고기정식,들깨수제비, 고등어구이', '주소': '06023  서울 강남구 언주로165길 7-4 (신사동)', '교통 정보': '3호선 압구정역 3번 출구에서 약 443m (도보 6분)'}","[{'review': '모던한 공간으로 압구정의 장사랑보다 쾌적해서 좋다. 바싹불고기가 이 집의 대표메뉴이기는 하나 impact 은 별로 없었고 오히려 된장찌개가 간간하고 맛있다. 가격도 약간 비싼듯하나 bearable하다. 단품 메뉴도 시도해볼만 할듯', 'score': '3'}, {'review': '프랜차이즈 한식당 입니다.\n가성비 좋은 고급 스타일 입니다.\n바싹 불고기가 정말 맛있습니다.\n점심에는 세트 메뉴도 다양하게 있어 좋습니다.\n모임 장소로 제격입니다.', 'score': '5'}, {'review': '들어가는 입구가 좀 멋있고 고급져요. 매장 내부는 편안한 분위기이고 무난한 한식메뉴와 살짝 가격대있는 구성입니다. 맛있었어요.', 'score': '4'}, {'review': '다양한 한식 메뉴가 있으며 특히 바싹불고기와 들깨수제비가 맛있습니다. 여러가지를 맛볼 수 있는 정식 메뉴도 제법 괜찮습니다.\n지하의 약간 허름한듯한 가게 분위기에 비해 살짝 비싼 편이지만 맛으로 모든 게 커버됩니다.', 'score': '5'}, {'review': '언양불고기를 비롯해서 전이나 국수 등 메뉴들 전체적으로 맛 좋고 괜찮은 식당임. 가격대는 약간 있는 편인듯~', 'score': '4'}]"
명화당,"30년이 넘는 오랜 전통을 자랑하는 전설적인 김밥집. 김밥 외에도 떡볶이, 비빔쫄면의 맛이 환상적이다. 떡볶이와 김밥 위주로 팔던 초창기와는 달리 지금은 만두, 우동 등의 메뉴가 다양해졌다. 가격대 만족도도 높은 편이다.","{'전화번호': '02-777-7317', '이용시간': '09:00 ~ 22:30', '휴무일': '명절 당일 휴무', '운영 요일': '월요일 ~ 일요일', '대표메뉴': '쫄볶이 냄비국수 비빔쫄면\n손만두 김밥', '주소': '04536  서울특별시 중구 명동4길 30 (명동2가)', '교통 정보': '4호선 명동역 6번 출구에서 약 246m (도보 3분)'}","[{'review': '20년전이나 지금이나 명동에서 가장 만만하게? 먹을 수 있는 곳입니다. \n가격이 그새 좀 올랐더군요. 그래도 여전히 부담없는 가격이예요. \n김초밥의 맛은 여전하구요...\n떡볶이는 점점 매콤한 맛을 잃고 너무 달아졌어요. \n다음번에는 쫄면으로 바꿔먹어야겠네요.', 'score': '4'}, {'review': '다양한 머꺼리로 넘쳐나는 명동이지만 명화당은 항상 그자리에서 꿋꿋하게 손님을 맞이한다.\n쫄면 떡복이와 유명한 명화당김밥이 주메뉴이지만 다른 우동이나 돈까스도 나쁘지 않다. 특히 김밥은 식초가 배합되어 있는 초밥을 사용하는데 어머니가 싸 주시던 김밥맛이나 더 친근하다.\n쫄볶기 양이 조금 준거 같아 아쉬운거 같기도하지만 비싸지 않은 가격에 항상 자기자리를...', 'score': '5'}, {'review': '가격도 많이 안 오르고, 맛도 한결같아서 가끔 생각나서 찾게됩니다. 하지만 좀 단 맛에 강해서 금방 질린다는 단점이 있습니다. 그리고 친절하지는 않아요. 주로 포장해서 가져옵니다. 식어도 맛이 많이 안변해요.', 'score': '4'}, {'review': '정말 예~~전부터 명동에서 알아주는 분식집이었다고 하는데 역시나 들어가보니 옛느낌이 물씬 풍기더군요. 가격은 그 때에 비해 많이 올랐지만 그래도 명동 주변 상권의 물가 대비해선 저렴한 편이예요. 떡볶이, 우동, 김밥을 먹었는데 음식은 그저 그랬습니다. 무엇보다 너무 달아서 놀랐어요;;', 'score': '4'}, {'review': '떡볶이는 좋아하는 사람은 뭘 먹어도 다 좋아하다고 할꺼라서.. 그런데 여긴 국물도 김밥도 적당한 기분좋은 단맛이 감돌아서 난 좋은데 싫어하는 사람도 있을듯. 그리고 쫄면 꼭 드세요.', 'score': '4'}]"
손맛김밥,"1980 년 문을 연 ‘ 할머니 김밥 ’ 을 어머니에게서 이어받은 지금의 사장님이 ‘ 손맛김밥 ’ 으로 다시 문을 열어 2 대 걸쳐 통인시장에서 자리를 지키고 있다 . 어머니의 요청으로 갓 대학에 들어간 이래로 매일 김밥 장사를 도왔던 것이 손맛김밥의 시작이었다 . 둘째 딸은 “ 엄마의 손맛이 좋으니 ‘ 할머니 김밥 ’ 이 아닌 ‘ 손맛김밥 ’ 으로 하자 ” 고 제안하였고 , 지금의 이름이 지어졌다 . 통인시장만의 독특한 화폐인 엽전으로 김밥을 구매하여 도시락 카페를 이용하는 이색 체험도 운영하고 있다","{'전화번호': '02-722-8389', '웹사이트': 'https://mo1022.modoo.at/', '이용시간': '07:00~18:00', '휴무일': '주말', '운영 요일': '평일', '이용요금': '손맛김밥 3,000원, 치즈김밥 4,000원, 참치김밥 4,000원', '주소': '03036  서울 종로구 자하문로15길 18', '교통 정보': '3호선 경복궁역 2번 출구에서 약 600m (도보 10분)'}",[]
남문토방,국산 미꾸라지를 갈아 제대로 만든 경상도식 추어탕과 통미꾸라지 튀김을 맛볼 수 있다. 유황을 먹여 키운 오리를 훈제하여 채소와 곁들인 유황오리 샤브샤브와 유황오리 전골도 구수하고 시원한 맛을 담고 있다,"{'전화번호': '02-778-6727', '이용시간': '10:00 ~ 22:00', '휴무일': '명절 휴무', '운영 요일': '월요일~일요일', '이용요금': '약 1~5만원대', '대표메뉴': '유황오리훈제샤브샤브, 유황오리더덕주물럭, 추어탕, 미꾸라지튀김', '주소': '04529  서울 중구 남대문시장길 45-3 (남창동) 지하 1층', '교통 정보': '4호선 회현역 7번 출구에서 약 303m (도보 4분)'}",[]
청송옥,서소문에서 장터 국밥으로 유명한 집. 소고기와 무가 들어 있는 사골국물로 된 장터 국밥에 국수를 말아 먹는다. 해장에도 좋다.,"{'전화번호': '02-754-1547', '이용시간': '10:00 ~ 22:00', '휴무일': '매주 일요일, 명절 휴무', '운영 요일': '월요일~토요일', '대표메뉴': '소고기국밥', '주소': '04515  서울 중구 서소문로11길 14 (서소문동)', '교통 정보': '1호선 시청역 10번 출구애서 약 170m (도보 2분)'}","[{'review': '늘 변함없는 맛있고 얼큰한 해장국 \n술마신 다음날 엄청 생각납니다. 술안마신날도 맛있는 국밥. 또 생각나네요~^^ 서울 시립미술관 들렀다가 꼭 한번 가볼만한 곳입니다. 강력추천!', 'score': '5'}, {'review': '얼큰하고 뜨끈한 국밥이 좋습니다. 밥이 따로 나오고, 소면이 들어있는 얼큰한 국물을 맛있는 김치에 먹을 수 있습니다.', 'score': '4'}, {'review': '소면을 넣어서 같이 먹는 것이 별미였던, 예전에 자주 갔던 곳인데요. 요즘은 글쎄요.. 가격도 너무 올랐어요 ㅠㅠ', 'score': '3'}]"
문화옥,"3대가 대를 잇는 50년 전통의 설렁탕 전문집. 사골과 양지 살로 낸 육수로 설렁탕 국물의 색깔이 진하다. 보통과 특이 있는데, 양지가 듬뿍 든 특이 실한 느낌이 든다. 족탕은 설렁탕의 육수에 잘 삶긴 도가니가 들어가서 설렁탕과 비슷한 느낌이다.","{'전화번호': '02-2265-0322', '이용시간': '06:00 ~ 21:00', '휴무일': '매달 4번째 일요일 정기휴무, 명절 휴무', '운영 요일': '월요일~일요일', '이용요금': '약 1 ~ 4만원대', '대표메뉴': '설렁탕', '주소': '04546  서울 중구 창경궁로 62-5 (주교동)', '교통 정보': '5호선 을지로4가역 4번 출구에서 약 62m (도보 1분)'}","[{'review': '탕을 시키면 고기도 많이 주고 국물이 진해서 좋아요. 다만 아줌마들이 싹싹하지는 않아요\n비씨 QR결제하면 2천원 할인도 됩니다', 'score': '4'}, {'review': '도가니탕을 주문. 도가니가 수입육이어서인지 흐물흐물 맛이 없고 양도 적고 넘 잘게 썰어넣어 씹는맛 없음. 일요일 점심때 갔는데 공깃밥이 하루 이상 보온밥통에 묵은것인지 보온밥솥 냄새가 심해서 안먹음. 기대이하로 실망함. 가격대비 맛,서비스,친절도 수준이하. 오래된 단골들로만 명맥 유지하는듯.', 'score': '3'}, {'review': '우래옥 바로 옆에 위치하고 있는 이곳은 60년이 넘은 노포입니다. 메뉴도 설렁탕을 기본으로, 도가니탕이나 꼬리곰탕, 수육 등을 내고 있지요. 특별한 맛이나 대단하다는 생각이 드는 맛은 아니지만, 적당히 깔끔하고 클래식한 맛을 잘 냅니다. 옛날 스타일의 설렁탕 맛이 고스란히 담겨 있지요.\n일부러 먼 곳에서 찾아 올 만한 곳은 절대 아니지만, 근처에 있고...', 'score': '3'}, {'review': '인근 유명맛집때문에 짝퉁이 아니냐고 오해받는 아쉬운 맛집.\n설농탕의 맛을 잘 알지못하지만 담백하게 한끼하기 좋은 맛집.\n김치는 당연히 맛있음.', 'score': '4'}, {'review': '을지로 오래된 설렁탕집입니다\n설렁탕만 한우입니다\n도가니탕은 호주산입니다 \n옛날분위기의 설렁탕집 \n점심시간에붐빈다고하던에 웨이팅이나 그런거없습니다 \n일단설렁탕은 시원한맛이네요 \n하지만반찬들이 조금아쉽습니다 \n도가니탕은 도가니가생각보다 많이들어있네요 \n그렇지만 특별하게 맛있거나 특별하게 맛없지는않네요', 'score': '3'}]"
스노브,"2층 가정집을 개조해 아늑한 분위기를 자아내는 카페. 군더더기 없이 재료도 장식도 깔끔한 것이특징. 케이크 외에도 초콜릿, 캐러멜 등 일본식 디저트들도 맛볼 수 있다.","{'전화번호': '02-325-5770', '웹사이트': 'http://www.snobblue.com', '이용시간': '12:00~21:00', '휴무일': '매주 월요일, 명절 휴무', '운영 요일': '화요일~일요일', '이용요금': '약 1만원대', '대표메뉴': '케이크', '주소': '04049  서울 마포구 와우산로 59 (상수동)', '교통 정보': '6호선 상수역 1번 출구에서 약 214m (도보 3분)'}","[{'review': '디저트 카페입니다. 케이크가 유명한 곳인 듯해요. 부드러우면서 많이 달지 않고 맛있었어요. 저는 서촌점에 갔는데 일반 가정집을 개조한 듯하여 내부가 특이했어요.', 'score': '4'}, {'review': '다들 일인일케이크 하드라구요 케이크가 진ㅉㅏ 맛잇어요 다음날도 생각나요 커피도 괜찬아요 진하네요', 'score': '4'}, {'review': '원래 밤을 그렇게 좋아하지 않지만 마롱 타르트가 맛있었다. 양도 많고 케이크 종류도 다양하다. 개인적으로 수요미식회에 나왔던 듀자X보다 훨씬 맛있었다. 다음에도 또 갈 의향이 있다.', 'score': '4'}, {'review': '홍대에 갈때면 들르는 곳. 나에게 케익은 이 곳이 가장 완성적인 맛이다. 비주얼도 맛도 최고다.', 'score': '4'}, {'review': '케익 하나하나 너무 맛있어요.\n분위기도 좋고, 약간 일본디저트 카페에 온 것 같은 느낌들어서 아주아주 좋았던 곳입니다. 데헷(\xa0⁼̴̤̆◡̶͂⁼̴̤̆\xa0)', 'score': '4'}]"
만족오향족발,"마니아를 많이 거느리는 전설적인 오향 족발집. 오향을 사용하여 비린내를 없앤 족발이 인기가 좋다. 식사로는 만둣국이 기본으로 나온다. 4시에 영업을 시작하지만, 저녁 늦게 가면 족발이 다 떨어질 수도 있으므로 서둘러야 한다. 간판에는 족발만두라고만 쓰여 있으므로 잘 찾아야 한다.","{'전화번호': '02-753-4755', '웹사이트': 'http://www.manjok.net/', '이용시간': '평일 11:30 ~ 22:00\n주말 12:00 ~ 22:00', '휴무일': '명절 휴무', '운영 요일': '매일', '주소': '04514  서울특별시 중구 서소문로 134-7 (서소문동)', '교통 정보': '1호선 시청역 8번 출구에서 약 70m (도보 1분)'}","[{'review': '최악의 서비스 그리고 \n고기도 다 부스러진거 주고 진짜 별로였음\n뭔가 추가 주문하려고 불러도 시큰둥 \n진짜 돈 주고 먹는데도 눈치 보이는 가게는 처음 \n엄마랑 이모랑 할머니랑 같이 갔는데 \n정말 잘 못 간 가게', 'score': '1'}, {'review': '맛있어요! \n회식으로 갔었는데 맛도 가격도 괜찮아서 집에갈때 포장해갔네요.\n그래도 따뜻할 때 먹는게 젤 맛있어요.\n서비스로 주시는 떡국도 좋았네요.\n다만 대기가 있어서 일찍 가시는 편을 추천합니다.', 'score': '4'}, {'review': '만족오향족발 시청점 정말 맛있어요\n배달시켜 먹었는데 부드럽고 쫄깃하고\n마늘소스에 찍어먹으면 느끼하지도 않고\n유명한 이유가 있어요', 'score': '4'}, {'review': '족발을 자주 먹지는 않지만 장충동 족발집도 자주 가고 이곳 저곳 많이 다녀봤어요 근데 여기가 제일 맛있고 생각나는 곳이에요!! 사람이 많은만큼 자리도 많고 직원들도 깔끔하게 유니폼 입고 친절하신거같아서 좋아요 음식도 따뜻하게 유지될 수 있도록 신경도 많이 쓰시고! 가격이 조금만 더 저렴했으면 더 자주갔겠지만 가끔 먹으러가기엔 괜찮아요', 'score': '5'}, {'review': '넘쳐나는 손님들을 생각하면 서비스도 훌륭한 편이고, 맛도 특별히 흠잡을 곳이 없음. 특히 따뜻하게 먹을 수 있도록 그릇을 데워주는 것이 인상적이었음.', 'score': '4'}]"
보건옥,"김치찌개와 삼겹살로 유명한 곳으로, 을지로4가 방산시장에 있는 숨은 맛집이다. 이 외에도 가격대비 질 좋은 소 불고기를 맛볼 수 있다. 김치찌개는 점심때만 한다.","{'전화번호': '02-2275-3743', '이용시간': '10:30~21:30', '휴무일': '매주 일요일, 명절 휴무', '운영 요일': '월요일~토요일', '주소': '04546  서울 중구 창경궁로8길 12 (주교동)', '교통 정보': '2, 5호선 을지로4가역 4번 출구에서 약 122m (도보 1분)'}","[{'review': '차돌박이, 등심주물럭이 맛있다. 슴슴한 불고기도 꼭 한 번은 먹어볼 만 하다. 복잡하고, 약간 불편하고, 적당히 소란한 실내는 편안하게 한 잔 하기 좋다. 싼 값에 소고기를 즐기기에 좋은 장소다. 다만, 내 경우, 처음 갔을 때와 두번 째 갔을 때 고기의 질이 달랐다. 처음 갔을 때의 퀄리티라면 기회가 될 때 마다 갈 것이다.', 'score': '4'}, {'review': '을지로 3가 공구상가 골목 안에 있습니다.\n불고기, 등심, 차돌박이 다 좋지만 육회가 최고입니다.\n식사로 설럴탕과 내장탕도 좋습니다.\n가족들과 같이 가기는 그리 깨끗하지는 않습니다.  찾기 어려운 것도 조금 아쉽네요.', 'score': '4'}, {'review': '허름한 을지로 골목에 이렇게 맛있는 한우 불고기집이 있을 줄이야. 정말 맛있어요~! 초행길에 찾기가 좀 어렵고, 주변에 2차로 갈 만한 집이 별로 없다는 게 단점입니다.', 'score': '5'}]"
진어참치,"참치와 더불어 30여 년을 살아온 사장은 자타 공인 참치 박사로, 카운터에서 주문을 하면 자세한 설명과 함께 다양한 참치를 맛볼 수 있다. 가격대비 만족도가 높은 편이다. 카운터에는 일곱 자리밖에 없으므로 예약 필수이다.","{'전화번호': '0507-1345-7412', '이용시간': '매일 16:30 ~ 22:00', '휴무일': '매달 3번째 화요일, 명절 휴무', '이용요금': '약 4 ~ 10만원대', '대표메뉴': '참치회', '주소': '03988  서울특별시 마포구 연남로3길 34 (연남동)', '교통 정보': '2호선, 경의중앙선, 공항철도 홍대입구 2번 출구에서 약 570m (도보 8분)'}","[{'review': '참치회가 1인분에 38,000원 부터 시작인 데 전 7만원 짜리를 먹었어요. 등급에 따라 가격은 나뉘는 것 같아요. 그렇다고 무한 리필 가격은 아니에요. 회가 계속 나오고 탕이 나오고 마지막으로 야끼가 나오는 데요, 제 느낌은 가격이 조금은 비싸다는 느낌을 받긴 했어요. 하지만 참치회 자체는 매우 훌륭한 곳이에요.', 'score': '5'}]"
삼호복집,"복어 하나로 30여 년 동안 변함없이 사랑받는 곳. 신선한 복과 싱싱한 채소, 시원하고 개운한 국물 맛을 내는 탕 요리가 일품이다. 얇게 저민 복어 살로 버섯과 채소를 돌돌 말아 살짝 익혀 먹는 복어 샤브샤브도 인기가 있다. 이 외에도 복스시, 버섯찜, 된장 뚝배기 등도 먹을 만하다.","{'전화번호': '02-337-9019', '이용시간': '11:30~21:30', '휴무일': '매주 일요일', '운영 요일': '월요일~토요일', '대표메뉴': '복매운탕\n맑은뚝배기\n복고니', '주소': '03789  서울특별시 서대문구 연세로5다길 10 (창천동)', '교통 정보': '2호선 신촌역 1번 출구에서 약 204m (도보 3분)'}","[{'review': ""깔끔한 식사, 복의 상태도 좋고 직원들의 서비스도 좋으나,\n맛은 홍대의 있는 '신원복집' 보다는 떨어지는 듯 하다.\n가격도 상당하고.."", 'score': '3'}]"
충무로 부산복집 (오금역),"시원하고 담백한 맛이 일품인 복요리 전문점  신선한 생복을 재료로 35년 동안 사랑 받아온 전통 복요리 전문점. 아삭하고 수분이 많은 무와 대파, 다시마로 우려낸 시원하고 담백한 국물맛은 잊을 수 없는 여운으로 남는다. 찾는 손님이 많아 겨울철에는 예약을 하는 것이 좋다.","{'전화번호': '02-404-3227', '이용시간': '매일 10:30 ~ 21:30', '이용요금': '약 3만원대', '대표메뉴': '생복매운탕/지리, 생복불고기, 참복샤브샤브', '주소': '05661  서울 송파구 중대로27길 9-1 (오금동, 동호빌딩)', '교통 정보': '3,5호선 오금역 1번 출구에서 약 224m (도보 3분)'}",[]
꽃지,"서산에서 가져온 꽃게로 만든 게장과 꽃게 요리가 정갈하게 나오는 곳. 간장을 사용하지 않고 어리굴젓을 숙성시켜서 담근 꽃게장의 향이 독특하다. 게장 외에도 꽃게찜, 산 낙지, 박속낙지탕 등 서해안의 명물들을 맛볼 수 있다. 반찬으로 나오는 어리굴젓 맛도 일품이다. 1인당 게가 반 마리씩 나오는 2인용 세트메뉴가 있어 게장을 저렴하게 맛볼 수 있다는 것이 장점이다.","{'전화번호': '02-561-8788', '웹사이트': 'https://kkotji.modoo.at/', '이용시간': '매일 11:30~21:30\n(Break Time 15:00~17:00)', '휴무일': '매주 일요일', '대표메뉴': '간장게장정식, 대하구이, 양념게장, 게살비빔밥, 뚝배기 꽃게탕', '주소': '06170  서울 강남구 봉은사로 610 (삼성동, 수도빌딩)', '교통 정보': '9호선 봉은사역 5번 출구에서 약 33m (도보 1분)'}","[{'review': '게장 음식점을 방문하면 먹을때는 흥미진진하고 신이 나나 먹고 난 후 집에 오면 반드시 배가 고파 다시 한번 배를 채우게 된다. 이는 게장의 맛이 문제가 아니라 섭취한 음식의 총량때문이리라. 각설하고  이 집의 간장게장은 간간하고 맛이 있었으나 양념게장은 신선하지도 않고 묻혀져 있는 양념도 오래된 듯 건조하고 색의 투명도도 현저히 떨어졌다. 보아하니...', 'score': '3'}, {'review': '간장게장 맛집으로 정말 좋아요\n원래 양념게장을 좋아하고 간장게장은 별로 좋아하지 않았는데 여기에서 간장게장 먹으면서 간장게장이 더 맛있다는 걸 처음으로 느꼈어요\n밑반찬은 깔끔했고 가격이 좀 비싸긴 하지만 정말 맛있게 먹었어요', 'score': '5'}, {'review': '아이가 게장을 먹고 싶어해서 갔는데\n맛은 괜찮았어요\n근데 식탁이 조금 끈적한 느낌....\n\n맛은 괜찮았는데\n아주 좋다!!!까지는....\n쏘쏘입니다', 'score': '3'}, {'review': '점심에 가면 점심메뉴도 팔아서 좋구요. 간장게장이 많이 짜지 않고 맛있어요. 반찬도 잘 나오구요. 꽃게탕도 괜찮습니다.', 'score': '4'}, {'review': '브레이크 타임 직전이었는데도 친절히 맞아주셨어요.\n음식이 대체적으로 깔끔하고 맛있어요\n게알도 너무 맛났어요. 짜지 않고 좋아요', 'score': '5'}]"
