상호,설명,업소정보,리뷰
소선재,"야생초를 사용한 건강 식단을 맛볼 수 있는 곳이다. 정식코스에는 근채쌈, 민들레와 야생초 샐러드, 야생초 야채전, 장김치 보쌈, 두부소박이와 식사 등이 나온다. 가격에 따라 닭고기 샐러드, 메로구이 등이 추가되기도 한다. 한옥을 개조해서 만든 열 개 테이블 정도의 작은 공간이다.","{'전화번호': '02-730-7002', '이용시간': '평일 11:30~14:30, 17:00~21:00 / 주말 11:30~14:30, 17:30~21:00', '휴무일': '명절 휴무', '이용요금': '약 2 ~ 5만원대', '대표메뉴': '떡갈비와 식사, 장아찌 보쌈과 식사, 보리굴비와 식사, 간장게장과 식사', '주소': '03049  서울특별시 종로구 삼청로 113-1 (삼청동)', '교통 정보': '3호선 안국역 1번 출구에서 약 1.3km (도보 20분)'}","[{'review': '외경부터가 한국 전통의 느낌이 물씬 풍긴다.  소박할 소, 반찬 선, 집 재,  소박한 반찬과 함께 밥을 먹는 집. 식당 이름처럼 음식들이 소박하지만 정갈하고 맛깔나게 나온다. 코스요리도 있지만 나는 보쌈정식과 낙지볶음 정식을 먹었는데, 둘 다 맛있었다.', 'score': '5'}, {'review': '정말 깔끔한 한끼를 먹을 수 있는 곳입니다. 조미료 맛이 하나도 안나는 정말 맛있는 곳입니다. 반찬하나하나가 정말 깔끔하고 정성담은 듯한 맛이었습니다. 조미료를 안넣고 만든듯 먹어도 질리지 않은 그런맛이었습니다. 자극적인 맛을 좋아하시면 별로라고 생각이 들수도 있습니다. 저는 간이 강하지 않은 음식을 좋아해서 그런지 정말 맛있다고 감탄하면서 먹었는데 저와...', 'score': '4'}, {'review': '들어가는 입구 간판부터 우리의 옛스러움이 묻어나오는 곳이이에요. 안에 내부는 넓진 않지만 적당한 크기에 깔끔한 한옥집이고, 음식 맛도 간도 강하지 않고 적당하게 입맛에 딱 맞는 음식입니다. 외국인 친구나 소개팅 장소로 좋을 것 같아요.', 'score': '4'}, {'review': '가게가 넓지는 않지만 반찬 하나하나가 정성들여 내놓은 소박하고 토속적인 것들이네요~마지막에 나오는  된장찌게도 구수하니 맛있었네요', 'score': '4'}, {'review': '한옥집 내부에 위치한 식당으로 외국인 접대하기에 좋을 듯 합니다. 장아찌 보쌈 정식과 떡갈비 정식을 시켜 먹었는데, 자잘한 반찬들과 함께 주요리와 밥 된장찌개 등이 나옵니다. 보쌈은 장아찌와 무(말랭이?) 조림과 같이 나오는데, 심심하게 싸먹기 좋습니다. 다른 곳에서 파는 강한 양념의 보쌈에 익숙한 분이라면 조금 싱거울 수도 있겠습니다. 다 먹은 뒤에는...', 'score': '4'}]"
타셴,"아트 북카페로, 독일의 유명 출판사인 타셴의 각종 예술 서적을 진열, 판매하며 15종류의 샌드위치와 커피, 음료를 독서와 함께 즐길 수 있다. 타셴 출판사의 미술 관련 책도 팔고 있다.","{'전화번호': '070-8876-5555', '웹사이트': 'https://siginis.com/2024/caftaschen_a/', '이용시간': '평일 08:00 ~ 20:00\n주말 10:00 ~ 19:00', '휴무일': '연중무휴', '대표메뉴': '샌드위치', '주소': '06643  서울 서초구 효령로 317 (서초동, 대한건축사협회)  1층', '교통 정보': '3호선 남부터미널역 2번 출구에서 약 200m (도보 3분)'}","[{'review': '한가롭게 차마시기 좋았어요. 쥬스류도 맛있었던 것 같아요. 주차가 2시간 가능해서 한가롭게 있기 좋더라고요.', 'score': '4'}]"
등대,"다양한 복요리를 전문으로 하고 있는 곳으로, 복지리가 맛있기로 유명하다. 숙취해소를 하기 위해 찾아오는 단골손님들이 많다.","{'전화번호': '02-562-0505', '이용시간': '매일 11:30~22:00', '휴무일': '매주 일요일', '대표메뉴': '복지리, 복샤부샤부, 참복샤부샤부, 복찜', '주소': '06177  서울 강남구 영동대로 342 (대치동, 덕유빌딩)', '교통 정보': '2호선 삼성역 2번 출구에서 약 414m (도보 7분)'}","[{'review': '활참복을 맛 볼 수 있다 냉동복껍질과는 비교가 되지 않는 참복껍질은 빙초산을 쓰지 않고 일일이 가시를 뺀다 사시미는 서브해 주시는 분이 미나리와 무순을 넣어 직접 말아 주신다. 튀김은 사시미와 다르게 두툼하게 살을 발라 튀기는데 바삭한 튀김옷에 복어의 따뜻한 생선살과 차가운 폰즈 소스의 조화는 최고다! 생물인 만큼 탕보다 지리가 깔끔하고 식사는 죽이 좋다!', 'score': '4'}, {'review': '시원한 복국을 즐길 수 있습니다. 다만 가격이 다른 복집에 비하여 거의 2배 정도 나간다고 보시면 됩니다. 점심에 간단히 복국만 먹는거라면 그래도 제대로된 복국을 즐길 수 있습니다', 'score': '4'}, {'review': '해장하기 딱 좋은 복국식당. 밀복정식이 1인당 4만원 선으로 가격대는 높은편임. 1층과 2층으로 이루어져 있음.', 'score': '4'}]"
단미그린비,'단미그린비'는 사랑스런 여인과 그리운 선비가 만나 화목한 가정을 꾸민다는 의미이다. 대모산 끝자락에 위치하여 자연을 바라보며 식사를 할 수 있는 전원 한정식당으로 여러가지 코스 음식을 즐길 수 있다.,"{'전화번호': '02-445-2100', '이용시간': '화~일 11:30~15:00, 17:30~21:00', '휴무일': '매주 월요일', '대표메뉴': '자연정찬, 귀연정찬', '주소': '06364  서울 강남구 밤고개로14길 13-50', '교통 정보': '분당선, 3호선 수서역 6번 출구'}",[]
올라,의왕시 백운 호숫가에서 이름을 날리고 있는 이탈리아 레스토랑 올라가 서울 분점을 낸 곳이다. 천장이 높고 넓은 실내가 시원한 느낌을 준다. 뚝배기 파스타가 유명하다.,"{'전화번호': '0507-1417-7220', '이용시간': '평일  11:30~14:30, 17:30~22:00 / 주말 11:30~15:00, 17:00~22:00', '대표메뉴': '참치 타르타르, 닭가슴살과 수제 리코타 치즈', '주소': '07236  서울 영등포구 의사당대로 38 (여의도동, 여의도더샵아일랜드파크)', '교통 정보': '5, 9호선 여의도역 1번 출구에서 약 578m (도보 8분)'}","[{'review': '평일점심 예약없이는 가기힘든곳 마늘바게뜨가 맛나고 세트메뉴가 일반메뉴보다 가성비가 좋으나 가격대가 주위보다 비싼편^^', 'score': '4'}, {'review': '파스타 종류 다 훌륭하고 단호박 스프가 끝내줍니다. 스프 다 먹고 단호박도 꼭 긁어서 먹어야해요 ~ 오징어먹물 리조또도 추천합니다! 다만 양은 좀 적을수있는데 식전빵이 정말 맛있어요', 'score': '5'}, {'review': '파스타를 포함해 음식 대부분 맛있습니다.여의도에서 분위기가 좋은 레스토랑이어서 데이트 장소로 추천합니다. 여의도에 2곳 있는데 KBS점이 더 분위기 좋습니다', 'score': '5'}, {'review': '여의도 식당중 가장 선호하는 곳중 하나. \n고급지고 분위기 좋은 신흥식당들이 곳곳에 생겼지만, 꾸준히 찾게 되는 매력이 있는 곳. 분위기와 맛, 모두가 만족스러운 이탈리안식당임.\n\n저녁시간엔 작은 모임이나 회식 등으로 북적거리긴 하지만, 다소 좁은 테이블에 샐러드, 스테이크, 라비올리, 리소또, 파스타 등의 각종 음식과 와인을 주문하고 대화에 열중해 있는...', 'score': '5'}, {'review': '여의도에 있는 올라는 2개입니다. 여기는 KBS쪽인데 가격은 비싸지만 맛은 있어요. 특히 식전빵이 참 맛있고. 리필도 가능합니다. 파스타 훌륭합니다.', 'score': '5'}]"
내자땅콩,"내자땅콩은 지금 대표의 아버지께서 50 년 전인 스물여섯 살 때 시작한 가게로 , 땅콩전병을 만들던 친척에게 기술을 배워 가게를 열었다 . 반세기 넘게 전병을 구워내는 내자땅콩에 들어서면 입구 맞은편에 땅콩전병을 만드는 기계가 보인다 . 연탄불에서 가스불로 바뀐 것 외에는 옛날 방식을 그대로 따른다 . 두 번 구워진 땅콩이 큼지막하게 박혀 있어 씹을수록 고소하다 . 하루에 약 130 봉지만 만드는 땅콩전병이 이곳의 대표 품목이다 . 파래전병과 생강전병도 인기가 좋다 .","{'전화번호': '02-730-7239', '이용시간': '11:00 ~ 16:00 (소진시 영업 종료/브레이크타임 13:00 ~ 13:30)', '휴무일': '일요일', '운영 요일': '월요일~토요일', '이것만은 꼭!': '12:30~13:30 브레이크타임', '주소': '03041  서울 종로구 사직로 111 (내자동)', '교통 정보': '3호선 경복궁역 1번 출구에서 약 103m (도보 1분)'}",[]
황태본가,"황태 요리로 유명한 집. 메뉴는 황태구이와 황태국, 시래깃국이다. 황태구이 정식에는 고추장 양념에 하루 정도 재워둔 황태를 불판에 올려놓고 알맞게 구운 다음, 파와 깨를 골고루 뿌려 먹음직스럽게 내온다. 오징어무침, 멸치볶음 등 반찬도 정갈하다.","{'전화번호': '02-786-8307', '이용시간': '평일 06:30~22:00', '휴무일': '일요일, 명절 휴무', '운영 요일': '월요일~토요일', '대표메뉴': '황태구이, 황태찜', '가격대': '1만원대', '주소': '07327  서울 영등포구 국제금융로2길 37 (여의도동, 에스트레뉴)', '교통 정보': '5호선 여의도역 3번 출구에서 약 12m (도보 1분)'}",[]
한남북엇국,"북어국 외에도 안줏거리가 많아 술 한잔하기 좋은 곳이다. 다양한 종류의 전이랑, 수육이 인기 메뉴이며 오징어무침도 괜찮다.","{'전화번호': '02-2297-1988', '이용시간': '월요일~토요일 08:00 ~ 15:00 / 16:00 ~ 23:00\n일요일 08:00 ~ 15:00 / 16:00 ~ 21:00', '대표메뉴': '한남북엇국 차림, 묵은지돼지찜, 민육전, 영덕 홍게장 비빔밥 차림', '주소': '04419  서울특별시 용산구 독서당로 65-7 (한남동)', '교통 정보': '6호선 한강진역 2번 출구에서 약 1.2km (도보 19분)'}","[{'review': '북엇국은 늦은시간에가면 다 떨어짐. 평일에도 예약은 필수! 여러 종류의 안주를 시켜봤지만 한번도 실패한 적 없는 이모님 손맛이 끝내주는 곳.', 'score': '5'}, {'review': '음식은 맛있어요. 간도 잘 맞습니다.\n저녁시간에 가면 술먹는 분위기라 시끄럽습니다. \n인테리어도 특별하지는 않습니다.\n근처에 한식 주점이 많지않기때문에 그래도 소중한 장소', 'score': '4'}, {'review': '북엇국집인줄 알았지만 다른 안주들이 주인 집으로 티비에 출연한 집이라 사람들이 항상 많아요.', 'score': '3'}, {'review': '아침에 가게가면 북엇국만 팔고있으며.점심이지난후에야 전종류를 팔기시작해요.\n북엇국은 보통수준이지만.안에들어있는 두부가 참 맛좋아요~', 'score': '4'}, {'review': '와인코케이지가 없는집, 안주는 양이 적고 비싼집, 맛도 좋지 않은 집, 하지만 이만한 집도 없다. \n가장 중요한 점수 획득 요인은 친절하고 싹싹한 젊은 직원들!!! 전혀 퉁명스럽지가 않다. \n그래서 맛이 좀 없는 것도, 안주 량이 적은 것도, 비싼 것도 참으며 즐기다 왔다...\n아쉽다면 역시 안주 맛 좀 개량해줬으면 한다.', 'score': '4'}]"
진주회관,"한국인들의 여름별미인 콩국수로 유명한 음식점이다. 밀가루에 감자가루, 견과류 등을 넣어 만든 면을 사용한다. 여름에는 진하고 고소한 콩국수가 최고 인기이고, 겨울에는 김치볶음밥이 인기다. 단골이 많아 늘 줄을 서야 한다.","{'전화번호': '02-753-5388', '이용시간': '평일 11:00~14:00, 14:30~21:00\n토요일 11:00~14:00, 15:00~20:00', '휴무일': '휴무일: 일요일', '운영 요일': '월요일~토요일', '이용요금': '약 1 ~ 2만원대', '주소': '04513  서울특별시 중구 세종대로11길 26 (서소문동)', '교통 정보': '1,2호선 시청역 9번 출구에서 약 104m (도보 1분)'}","[{'review': '여름마다 이용하는 나의 최애 콩국수 집 오늘은 회사 점심시간에 이용했어요 언제나 맛있는 집 대기가 길어서 그게 조금 힘든데 기다린 만큼 가치있어요', 'score': '5'}, {'review': '아버지 모시고 진주회관 갔는데 콩국수 너무 맛있게 먹었습니다 김치도 맛있어요  다음에 또 올게요 번창하세요. 항상 여름이 기다려지내요', 'score': '5'}, {'review': '음식을 먹고 안좋은 리뷰를 쓰기는 처음이다…\n너무 최악이어서. \n\n아무리 맛집이라고 해도 직원 한 분이 너무 불친절하다 못해 우리 집 나이지긋한 어른이 다드시고 나오며 주차권 어디서 받는 지 물었는데, \n\n서빙하는 아줌마가 반말로 그리고 삿대질하며 \n“그걸 왜 나한테 물어 절로 가” 라는 명령은 어디서 못배워먹는 말인지… 본인보다 나이가 몇살은 더 많은...', 'score': '1'}, {'review': '걸쭉한 콩국수와 새콤달콤한 김치볶음밥이 매우 맛있는 곳입니다. \n\n6-8,9월 사이에는 콩국수만 판매합니다. \n\n주기적으로 찾게 되는 곳입니다. \n\n가게 바로 앞에 주차장에 주말에는 30분 무료주차가 가능합니다.', 'score': '5'}, {'review': '걸죽한 콩국수는 진주회관이지!!\n진주회관은 워낙 오래되기도 했지만\n유명하기까지해서 항상 웨이팅이 있었어요\n점심시간에 꼭 가니까 ㅋㅋ\n특히나 여름철엔 콩국수만 해서\n선택의 여지도 없지만\n어차피 콩국수 먹으러갔으니 괜찮아요\n먼저 선결제 해야하구요\n콩국수랑 김치가 세트로 나옵니다\n콩국수는 진짜 걸죽해서 고소하구요\n김치는 그에 맞게 딱 맛있어요', 'score': '4'}]"
비금도,"육전과 남도 음식을 즐길 수 있는 한식집. 전 요리를 다 먹으면 찐 밥과 남도 반찬 10가지, 국, 누룽지가 제공된다. 깻잎장아찌, 전복 내장, 갓김치 등의 남도식 반찬이 깔끔하고 맛깔나다.","{'전화번호': '02-512-1714', '이용시간': '월요일~금요일 11:30~23:00\n토요일 17:00~23:00', '휴무일': '명절 휴무', '대표메뉴': '비금도코스요리, 육전, 삼합, 산낙지탕', '주소': '06015  서울 강남구 압구정로80길 26 (청담동, 노아빌딩)', '교통 정보': '수인분당선 압구정로데오역 4번 출구에서 약 642m (도보 11분)'}",[]
양마니,소의 위를 뜻하는 양을 먹을 수 있는 곳. 신선도와 육질이 특히 뛰어나다. 자체 개발한 소스에 24시간 재웠다가 구워먹는데 담백하고 고소한 맛이 일품이다. 양 외에도 한우나 전골을 맛볼 수 있다.,"{'전화번호': '0507-1421-9282', '이용시간': '매일 10:00~14:30, 16:30~22:00', '휴무일': '명절 휴무', '운영 요일': '월요일~일요일', '대표메뉴': '특양구이, 대창구이, 한우등심', '가격대': '2만원대', '주소': '07238  서울 영등포구 국회대로76길 16', '교통 정보': '9호선 국회의사당역 2번 출구에서 약 435m (도보 6분)'}","[{'review': '점심에 양돌솥밥과 고등어구이를 주문해서 먹었어요. 맛도 괜찮고 반찬도 깔끔하고 정갈했어요. 점심식사 치고는 가격은 조금 있는 편이지만 갈만한 곳이에요.', 'score': '4'}, {'review': '여의도 북단 서강대교 쪽 켄싱턴 호텔 여에 있으며, 소곱창류를 요리하는 곳입니다. 고기의 특수 부위를 취급해서 그런지 점심시간에도 예약을 해야 할 정도로 인기가 있으며, 가격대는 중상위 정도입니다. 깨끗한 이미지와 시설이 훌륭합니다.', 'score': '4'}, {'review': '저녁때는 비싸긴 하지만 맛있는 양고기를 먹을 수 있고, 점심때는 여러 한식 메뉴를 맛 볼수 있습니다. 맛있는 밑반찬도 많이 줍니다.', 'score': '4'}, {'review': '대창구이가 맛있습니다. 다만 가격이 상당히 비싸다는 게 흠입니다. 점심메뉴인 돌솥양밥도 12천원으로 저렴하진 않지만 양도 많이 들어있고 맛도 좋습니다.', 'score': '4'}, {'review': '소곱창을 맛있고 깔끔하게 합니다. 가격대가 좀 있으니 곱창은 조금만 먹고 밥을 볶아먹거나 갈비탕 등 탕 종류를 하면 좋습니다.\n비즈니스맨들에게도 가격대가 좀 부담스러운 집입니다.', 'score': '3'}]"
그릴아지사이,"일본인 조리장이 만들어 내는 일본 본토식 요리를 맛볼 수 있는 곳으로 큰 인기를 끌고 있다. 돈가스, 스키야키, 오므라이스 등의 점심 메뉴도 주변 직장인들에게 인기가 있어 점심때는 줄을 서야 한다. 저녁때 이자카야 삼아 사케를 즐기기에 좋다.","{'전화번호': '02-565-7442', '이용시간': '11:30~13:30, 17:30~23:00', '휴무일': '매주 토요일, 일요일', '운영 요일': '월요일~금요일', '대표메뉴': '간바레오또상SET, 시로미, 돈샤브 샐러드, 가이센동', '가격대': '2만원대', '주소': '06133  서울 강남구 테헤란로13길 8-10 (동영빌딩)', '교통 정보': '2호선 역삼역 4번 출구에서 약 239m (도보 3분)'}","[{'review': '역삼역 한국타이어 근처에 위치한 그릴아지사이! \n일본에서 맛본 아사히 생맥주가 그립다면 여기오세요.\n점심 메뉴도 따로 있어 점심에 찾기에도 부담없어요.\n좌식, 테이블석이 있는데 가게는 좀 좁은 편입니다.\n고로케, 카라아게도 맛있어요', 'score': '4'}, {'review': '사무실이 근처에 있어서 종종 들르는 곳인데 주변 직장인, 관광객 등에게 인기가 많아서 항상 식사시간에는 웨이팅이 있는 곳입니다. 12시~1시 사이는 피하시는 것이 좋아요. 아무거나 시켜도 다 맛있지만 특히 추천메뉴는 고민가츠와 고로케 오므라이스입니다. 그래도 고민이 되신다면 매일 ""오늘의 메뉴""를 1,000원 정도 할인하여 판매하니 드셔보시면 좋을 듯...', 'score': '5'}, {'review': '저녁에 사케 또는 나마비루와 고로케를 가볍게 즐기기 좋은 장소이다.\n다소 협소하여 테이블간 간격이 좋은 것이 단점이지만, 고로케 맛이 워낙 좋아 자주 이용하는 것 같다.', 'score': '4'}]"
혜화칼국수,"30년 가까이 운영되고 있는 혜화동 토박이 음식점으로, 옛날 그대로의 모습을 간직하고 있는 곳이다. 사골 국물에 양지를 삶은 국물을 섞어서 24시간 동안 푹 끓여 깊은맛을 낸 국물에 가늘게 썬 칼국수 맛이 일품이다. 칼국수 외에 소고기를 얇게 저며서 불고기 양념을 해서 석쇠에 구운 바짝불고기와 생선튀김, 문어 등도 있다.","{'전화번호': '0507-1428-8214', '이용시간': '11:00~21:00 (브레이크타임 15:00~16:00 / 라스트오더 20:30)', '휴무일': '명절 휴무', '운영 요일': '월요일 ~ 일요일', '주소': '03076  서울특별시 종로구 창경궁로35길 13 (혜화동)', '교통 정보': '4호선 혜화역 4번 출구에서 약 403m (도보 7분)'}","[{'review': '시원하고 깊은 사골칼국수와 생선튀김의 조화가 기가막히다.\n우선 가게 외관만 봐도 이곳의 내공을 느낄 수 있다.\n중면으로 뽑은 칼국수를 진한 사골국물에 내어 사기그릇에 가득 담아주는데\n이것만 먹어도 배가 터질 듯이 부르다.\n하지만 이곳에서 생선튀김을 빼놓으면 절대 안된다.\n배가 터질 것 같아도 꼭 생서튀김을 먹어야한다.', 'score': '4'}, {'review': '오래된 집 느낌이 물씬나는 칼국수집입니다. 인터넷에 많이 나와있네요. 칼국수는 국물맛이 구수하고 가성비가 좋았습니다.', 'score': '4'}, {'review': '딱 겉에서부터 간판을 보면 연륜이 느껴지네요. 메뉴는 칼국수말고도 수육이나 불고기가 있는데 저는 칼국수 먹었습니다. 특별한 비쥬얼은 아닌데 맛있어요.', 'score': '4'}, {'review': '명륜동 3대 칼국수 중의 하나 수육과 문어가 맛있고 국수는 사골국물이다 면발은 국수면발로 일반 칼국수 면은 아니다 불고기랑 생선튀김도 괜찮다', 'score': '5'}, {'review': '사골국물 베이스로 진국입니다. 먹을때도 맛있지만 먹고나면 계속 생각나는 집. 응답하라 1984에도 나온집이랍니다', 'score': '5'}]"
대방골,"대방골 한정식집에서는 잘 말려서 짭짤한 굴비를 녹차물에 말아먹는 별미는 물론, 무안 뻘낙지, 흑산도 홍어, 흑산도 전복도 즐길 수 있다.","{'전화번호': '02-783-4999', '웹사이트': 'https://www.instagram.com/daebanggol_official/', '이용시간': '평일 11:20~14:30, 17:00~22:00 / 주말 11:20~21:00', '휴무일': '연중무휴', '운영 요일': '매일', '대표메뉴': '대방골정식, 솔잎찜보리굴비한정식, 연포탕한정식, 솔잎찜보리굴비매생이정식', '주소': '07238  서울 영등포구 국회대로 800 (진미파라곤)  지하 1층', '교통 정보': '9호선 국회의사당역 1번 출구에서 약 358m (도보 5분)'}",[]
희정식당,푸짐한 소시지와 햄 사리의 부대찌개 전문점이다. 얼큰하고 걸쭉한 국물도 얼큰하고 좋다. 인근 여의도 직장인들에게 많이 알려진 곳이다. 저녁때는 푸짐한 T본 모둠스테이크도 인기가 있다.,"{'전화번호': '02-784-9213', '이용시간': '월요일~토요일 11:30~23:00', '휴무일': '매주 일요일, 명절 휴무', '대표메뉴': '특.희정부대찌개, 티본모듬스테이크, 등심스테이크', '주소': '07336  서울 영등포구 여의나루로 117  지하', '교통 정보': '5호선 여의나루역 1번 출구에서 약 155m (도보 2분)'}","[{'review': '스테이크에 각종 햄들과 야채 그리고 신 김치를 함께 볶아 주는 한국식 스테이크 입니다.\n그냥 먹어도 맛있는 고기에 각종 감칠맛이 나는 재료들과 함께 볶아주니 한국인의 입맛에 딱 맞는 곳이라 생각합니다.\n이 식당은 스테이크가 메인이지만 식사로 먹는 부대찌게도 일품입니다.\n부대찌개는 맛의 차이가 크기 힘든 메뉴입니다.\n하지만 이곳의 부대찌개는 매우 깔끔한...', 'score': '5'}, {'review': '밥을 먹는 내내 불편했어요. 내 테이블에 잇는 휴지 하나도 원래 있던 자리로 가져다 놓는 사장님... 정말 친절하게 웃으며 손님을 맞으시는데 반해 종업원 분들께는 압박이 너무 심하신 모습에 대화내용이 다 들려서 밥을 먹는 내내 체할 것 같은 느낌. 계산하러 가는 길에 종업원이 일하시는 모습을 못마땅하게노려 보시다가 저를 보더니 표정을 바꾸시던 사장님...', 'score': '2'}, {'review': '정말 사람이 많아서 맛집이 맞긴 맞나보네 하고 들어갔다. 들어가자마자 인수대로 특부대찌개를 시켰다. 친구가 많은거 아니냐며 걱정했는데 예상보다 우리가 너무 많이 먹어서 깜짝 놀랐다. 묵직하고 햄이 많아서 많이 못먹을줄 알았는데 밥도 비우고 냄비도 싹 비웠다. 정말 깜짝 놀라게 맛있기 보다는 나도 보르게 흡입하게 되는 매력이 있다.', 'score': '4'}, {'review': '방송들 보고 다녀왔는데, 평범한 부대찌개 맛이였어요. 햄과 고기가 많이 들어가서 햄이랑 고기를 좋아하시는 분들은 좋아하실 듯, 보통 고기가 많이 들어가면 느끼한 잡맛이 좀 나는데 마늘을 듬뿍넣어서 그 맛을 잡나봐요. 주차는 주변에 알아서 하셔야 하는데 주차할데가 거의 없구요. 식당도 그리 깔끔하지는 않습니다. 여의도 주변에서 근무하신다면 가볼만한데 멀리서...', 'score': '3'}, {'review': '이미 여의도에 근무하는 직장인들에게는 유명한 맛집\n짜지않고, 햄맛이 강하지 않은 부대찌개-\n유난히 식감이 좋은 채소들이 먹을수록 맛있음\n가수출신(?) 사장님이 아주 친절함\n\n*단점\n주차 안됨\n점심시간 피해서 방문할 것(직장인들 인해전술 장난아님..)', 'score': '4'}]"
