상호,설명,업소정보,리뷰
금강바베큐치킨,생맥주와 치킨을 저렴하게 먹을 수 있는 곳. 다양한 종류의 치킨이 있지만 바비큐 치킨과 마늘 치킨이 대표 메뉴이다. 숯불에 굽는 바비큐 치킨은 숯향이 배어 있어 별미이다. 계란말이는 서비스로 제공된다.,"{'전화번호': '02-511-0976', '이용시간': '월요일~토요일 15:30~23:55', '휴무일': '명절 당일 휴무', '운영 요일': '매주 일요일', '대표메뉴': '치킨', '주소': '06542  서울특별시 서초구 사평대로 349 (반포동)', '교통 정보': '9호선, 신분당선 신논현역 1번 출구에서 약 237m (도보 3분)'}","[{'review': '이 자리에 꽤 오랫동안 지켜온 이동네 터줏대감 같은 곳으로 알고 있는데 사실 특별한 맛은 \n\n잘 모르겠습니다. 분명 이집만의 치킨맛이 존재하기는 합니다. 아재의, 아재에 의한, 아재\n\n를 위한 그런 곳임에는 분명합니다 ㅎㅎ 직원분들 친절하시고 좋습니다~ 잘 먹었습니다.', 'score': '3'}, {'review': '예전엔 그 골목에 치킨집이 많았는데 이젠 몇곳 안남았더라구요.\n춧불바베큐치킨 시켰는데 계란말이랑 샐러드 치킨무가 제공되고,\n숯불향이 은근히 베인 치킨은 맛이 좋았습니다.', 'score': '4'}, {'review': '사실 치킨 맛은 특별한 것은 없습니다만, 오래된 옛날 호프집같은 분위기와 특유의 전통적인 느낌이 이 가게를 땡기게 하는 것 같습니다.', 'score': '4'}, {'review': 'KCC 본사 맞은편 도로에 있는데, 옆에 치킨집 2-3곳이 쭉 붙여 있고요, 금강바베큐는 상당히 오래된 집입니다.\n\n일반적으로 기름에 튀긴 후라이드 치킨이 아니라 숯불에 구워서 기름기가 별로 없고 맛있습니다. 개인적으로는 양념이 더 맛있고요..\n계단말이랑 몇 가지 과자 안주는 서비스도 주고요, 생맥주에 먹기 괜찮은 곳입니다.', 'score': '4'}, {'review': '논현동에 있는 숯불바베큐치킨 오래된 전통이 있고\n유명한 치킨거리이지요!숯불에 구운 양념바베큐가 맛잇어요~', 'score': '4'}]"
평양집,숯불에 굵은 철근으로 된 석쇠를 올리고 구워 먹는 차돌박이가 인기 메뉴이다. 고기를 찍어 먹는 새콤 달콤한 양념장이 맛이 좋으며 양곱창도 인기. 밑반찬은 양배추와 생마늘 뿐이다. 식사 메뉴도 양을 썰어 넣고 깍두기와 볶는 양밥 뿐이지만 맛은 일품이다. 새벽에 문을 열며 내장탕을 아침으로 먹을 수 있다.,"{'전화번호': '02-793-6866', '이용시간': '07:00 ~ 22:00', '휴무일': '매주 월요일, 명절 휴무', '운영 요일': '화요일~일요일', '이용요금': '약 1 ~ 2만원대', '대표메뉴': '양곱창', '주소': '04382  서울특별시 용산구 한강대로 186 (한강로1가)', '교통 정보': '4,6호선 삼각지역 14번 출구에서 약 36m (도보 1분)'}","[{'review': '고기는 얼렸다 녹인것..머리카락ㅍ둘둘 말려있고 반친은 양배추 ..지저분하고 ..머리카락나와도 미안해하지않고..너무 질기고...여기 뭐지 싶음 집앞이라도 다신안감', 'score': '1'}, {'review': '직장 동료의 인사발령으로 조촐하게 차돌박이로 소주 한잔을 샀다. 주인공은 1차가 끝난뒤 옆집 차돌박이와 비교해 보자고 하길래 1차.2차를 모두 차돌박이로 술을 마신 불상사가 ㅋ\n소주 안주로 좋아요^^', 'score': '4'}, {'review': '차돌박이 먹고 양밥으로 마무리했습니다\n차돌박이가 다른곳보다 두껍네요\n사람은 연령대 다양하게 많았습니다. \n아무래도 소라서 가격은 좀있구요 \n사람이많아서 가끔 메뉴가 주문ㄴㅈ잘안들어가는경우가있으니 잘확인하시는게 좋을것 같습니다 .', 'score': '4'}, {'review': '개인적으로 차돌박이를 좋아하는 1인으로써 방송보다가 또 좋아하고 즐겨보는 프로그램에서 진행자 두 분이 서로 좋아하는 맛집이라고 해서 궁금해서 찾아갔습니다만, 지금까지 이런 차돌박이는 없었다... 어찌나 질기고도 기름지던지 정말 딱 2인분만 먹고 바로 나왔네요. 젤 늦게 들어가서 가장 먼저 자리에서 일어나지 않았나 싶습니다', 'score': '3'}, {'review': '점심에 양밥을 먹으려고 삼각지의 평양집을 들렀는데 진짜 맛있는 장소 입니다. 국방부 근처에서 정말 유명한 집중에 하나로 군인들에게도 유명한 맛집이에요', 'score': '4'}]"
주빈,"아담한 공간의 핸드드립 커피 전문점. 커피를 산지별로 15가지 이상 갖추어 두고 있으며, 로스팅을 직접 하기 때문에 항상 신선한 커피를 맛볼 수 있다. 갓 볶은 커피를 가장 좋은 맛으로 내리기 위해 융을 이용한 추출을 하는 것이 특징이다.","{'전화번호': '0507-1410-7967', '웹사이트': 'http://www.jubean-coffee.com', '이용시간': '월요일~금요일 10:00~21:00\n토요일 12:00~20:00', '휴무일': '일요일', '운영 요일': '월요일~토요일', '주소': '07331  서울특별시 영등포구 의사당대로 127 (여의도동)', '교통 정보': '5,9호선 여의도역 5번 출구에서 약 234m (도보 3분)'}","[{'review': '여의도 롯데캐슬에 있는 매장입니다. 비교적 아담한 카페인데 드립커피를 잘 하는듯 하네요. 시원한 아이스아메리카노 아주 좋았어요', 'score': '4'}, {'review': '맛난 커피를 마실 수 있는 곳. 점심 때 항상 사람이 붐빈다. 포장가격과 내부에 들어가서 마시는 가격이 차이가 있다. 포장가격이 저렴.', 'score': '4'}, {'review': '대한민국에 COE를 최초로 선보였다는 가게. 지금도 엘살바도르와 브라질 두 개의 COE 원두를 취급하고 있음. 융드립으로 내려 향을 보전하는 것이 특징적인 곳. 내부 인테리어가 아기자기한 개인 카페 느낌이라 편하게 맛을 즐기기 좋다.', 'score': '5'}, {'review': '체인점 에스프레소 커피 말고 핸드드립 커피나 스페셜티 커피를 마시고 싶을 때 가면 좋을 것 같습니다.  융드립으로 내려주는 곳입니다. 인테리어가 세련되지는 않았어요.', 'score': '4'}, {'review': '매장인테리어 보다는 커피맛에 신경을 쓴 느낌이 강한 정말 커피전문점 입니다. 드립도 융드립으로 하다보니 일반 드립보다 더 부드럽고 맛이 좋았습니다.', 'score': '5'}]"
차만다 서울숲점,"서울숲에 위치한 차만다 레스토랑은 영국 가정식을 전문으로 하는 곳이다. 영국 미슐렝 레스토랑 출신 셰프가 운영하며 치킨 티카 마살라, 피쉬 & 칩스, 셰퍼드파이 등 다양하고 맛있는 영국 음식들을 맛볼 수 있다. 아늑하고 따듯한 분위기의 인테리어와 서울숲이 보이는 창이 있어 분위기 좋은 데이트 장소로 사랑받고 있는 곳이다. 사계절 언제 방문해도 아름다운 차만다 레스토랑에서 신선하고 맛있는 영국 가정식에 빠져보자.","{'전화번호': '02-6448-0812', '이용시간': '평일 11:30 ~ 21:30 (Break Time 15:00 ~ 17:30)\n주말 12:00 ~ 21:30 (Break Time 15:00 ~ 17:00)\n공휴일 12:00 ~ 21:30 (Break Time 15:00 ~ 17:00)', '운영 요일': '매일', '대표메뉴': '셰퍼드파이 24,000원\n피쉬&칩스 32,000원', '주소': '04768  서울 성동구 서울숲2길 28-12 (성수동1가)', '교통 정보': '수인분당선 서울숲역 5번 출구에서 약 500m (도보 7분)'}",[]
피겨앤그라운드,"‘피겨앤그라운드’는 건축에서 흔히 사용되는 재료인 적벽돌옷을 입고 있지만 얇은 띠를 두른 듯한 외관이 강렬한 세련미를 내뿜는다. 지어진 지 30여 년이 넘은 오래된 건축물의 특색을 남긴 채 재구성하여 리모델링 했다는 점에서 더 의미가 있다. 저층부에는 카페와 편집숍이, 상층부에는 공유 오피스가 한 건물에 함께 공존하는 ‘피겨앤그라운드’는 평일과 주말, 낮과 밤 모두 활기를 띤다.","{'이용시간': '1층 카페(컨플릭트스토어) 매일 11:00 ~ 22:00', '주소': '06036  서울 강남구 논현로153길 53 (신사동, 피겨앤그라운드)', '교통 정보': '3호선, 신분당선 신사역 8번 출구에서 약 541m (도보 8분)'}",[]
램하우스,"양고기 전문점으로, 육질이 부드러운 어린 양을 잘 숙성시켜 양 갈비구이, 양 곰탕, 수육, 전골 등으로 낸다. 들깻가루를 듬뿍 넣은 양 곰탕과 수육은 식사로도 좋다. 매장이 아담하고 깔끔한 느낌이다.","{'전화번호': '02-3476-0678', '이용시간': '평일 10:00~22:00, 토요일 10:00~21:00', '휴무일': '매주 일요일, 명절 휴무', '운영 요일': '월요일~토요일', '이용요금': '약 1 ~ 5만원대', '대표메뉴': '양갈비, 램꽃등심, 전골', '주소': '06596  서울특별시 서초구 법원로2길 15 (서초동)', '교통 정보': '2,3호선 교대역 10번 출구에서 약 146m (도보 2분)'}",[]
미엘,"미술전시관과 카페가 만난 스타일리시한 카페. 화이트를 소재로 한 실내 분위기가 밝으면서도 멋스럽다. 와플, 샌드위치 등의 가벼운 디저트 류가 인기가 있다.","{'전화번호': '0507-1351-2395', '이용시간': '10:00~23:50', '휴무일': '연중무휴', '운영 요일': '월요일~일요일', '이용요금': '약 1 ~ 4만원대', '주소': '06016  서울특별시 강남구 도산대로67길 13-12 (청담동)', '교통 정보': '수인분당선 압구정로데오역 3번 출구에서 약 453m (도보 8분)'}","[{'review': '남자알바생 서비스 엉망입니다\n커피잔 테이블에 던지듯 놓아서 컴플레인했더니 두손으로 드려야하나며 되묻네요.\n고등학생 같은 알바가 언성 높이면서..\n어디서도 이런 서비스를 받아본적 없어서..\n\n라떼,카푸치노 미지근하고요\n한잔 가격 15,000인데 왜 왔나 싶네요..\n카페 분위기는 조용하고 아늑하고 좋습니다.', 'score': '1'}, {'review': '미엘도 아주 오래된 곳입니다. 엄청난 맛집이라기보단 추억을 찾기 위해 가는 곳이 되어버린 곳 같네요ㅋ 추억이 있으신 분들께만 추천해요. 김치볶음밥 너무 맛있어요', 'score': '4'}, {'review': '여긴 김치볶음밥이 정말 맛잇어요. 이 가격을 주고 김치볶음밥을 먹어야하나 생각도 들지만 또 미엘에만 파는 메뉴들을 먹고싶을 때 딱히 갈만한 곳이 없더라구요.', 'score': '4'}, {'review': '호박 케이크 아주 맛있습니다.\n커피 맛도 좋은 편입니다.\n분위기도 좋고 인테리어도 좋은 집.\n조용하고...\n테이블 간격도 좋고...\n다른 디저트들도 좋습니다.', 'score': '5'}, {'review': '편한하고 세련되고 심플한 인테리어가 좋아요. 가격대는 조금 높은 편이지만,청담동이라는 위치를 고려할 때 합리적인 편이라고 생각합니다. 음식도 맛있어요.', 'score': '5'}]"
소도,여의도에서 고급스럽게 일식을 즐길 수 있는 곳. 저녁 사시미코스가 훌륭하게 나오며 점심회정식도 괜찮은 편이다. 손님을 모시는 장소로도 좋다.,"{'전화번호': '02-783-3155', '이용시간': '월~토 11:30 ~ 22:30', '휴무일': '매주 일요일', '대표메뉴': '점심회정식, 저녁코스', '주소': '07332  서울 영등포구 의사당대로1길 11 (여의도동, 메종리브르오피스텔)', '교통 정보': '9호선 샛강역 1번 출구'}",[]
차크라,"탄두리 치킨, 양고기 케밥, 5가지 종류의 커리와 무한 리필되는 난과 쌀밥 등을 맛볼 수 있다. 빈대떡처럼 팬에 지져 먹는 우타팜과 도사를 인도 정통식으로 먹을 수 있다. 바삭한 맛의 삼발 반다도 인기 메뉴. 직장인들을 위한 점심 뷔페도 마련되어 있다.","{'전화번호': '02-796-1149', '웹사이트': 'http://www.chakraa.co.kr/', '이용시간': '매일 12:00~15:00, 17:00~21:00', '휴무일': '연중무휴', '이용요금': '약 1 ~ 10만원대', '대표메뉴': '치킨 마크니, 탄두리 세트, 야채 커리', '주소': '04419  서울특별시 용산구 독서당로 83 (한남동)', '교통 정보': '경의중앙선 한남역 1번 출구에서 약 758m (도보 10분)'}",[]
뀌쏭82,"소프트 프렌치 퀴진을 콘셉트로 내세운 프랑스 레스토랑이다. 서울에서 손꼽는 레스토랑에서 경력을 쌓은 김영원 셰프가 문을 연 곳으로, 프랑스 가정집에 온 듯한 편안한 공간에서 정통 프랑스 가정식을 즐길 수 있다. 프렌치 비스트로를 표방하면서도 가격이 저렴한 편이어서 오픈하자마자 많은 인기를 얻고 있다.","{'전화번호': '02-529-3582', '이용시간': '화요일 17:50~22:00\n수요일~토요일 11:50~22:00\n일요일 11:50~21:30', '휴무일': '매주 월요일', '대표메뉴': '암돼지삼겹살, 퐁피두(광어와 루꼴라)', '주소': '06302  서울 강남구 양재천로 167  아성빌딩 1층', '교통 정보': '3호선 매봉역 4번 출구에서 약 741m (도보 10분)'}",[]
뚜르뒤뱅,"5백여 종의 와인과 치즈, 샐러드, 스파게티가 준비되어 있는 곳으로, 시중에서 만나볼 수 없는 이색적인 와인이 꽤 있다. 옆에는 테이블이 있어 직접 고른 와인을 바로 마실 수 있다.","{'전화번호': '02-6941-1846', '이용시간': '13:00 ~ 01:00', '휴무일': '매주 일요일, 명절 당일', '운영 요일': '월화수목금토', '이용요금': '약 1 ~ 4만원대', '대표메뉴': '와인바', '주소': '06576  서울 서초구 사평대로22길 55 (반포동, 대선빌딩)', '교통 정보': '7호선 고속터미널역 5번 출구'}","[{'review': '서래마을 치고 저렴한 가격에 와인과 안주를 즐길 수 있는 곳이라 추천합니다. 오후 7시인가 8시전에 들어가면 와인 할인 되기도 해요 . 꼭 가보세요. 좀 골목안이라서 찾기 어려울 수도 있어요', 'score': '4'}]"
헤르지아,"스페인어로 해바라기라는 뜻의 이탈리안 레스토랑. 호주산 청정우를 사용한 부드러운 안심스테이크가 인기 메뉴이다. 등심, 해물, 야채를 한데 섞어 소스를 넣고 볶은 데판야키도 좋다. 지하 1층은 커플석으로 되어 있고 롤 스크린을 치면 방해받지 않고 식사도 가능하다. 2층은 명동, 남산의 야경을 즐기기에 좋다.","{'전화번호': '02-319-5150', '이용시간': '매일 10:30 ~ 21:00', '운영 요일': '연중무휴', '이용요금': '9천원~2만원대', '대표메뉴': '베이컨 까르보나라, 왕돈까스, 매운치즈돈까스, 함박스테이크', '주소': '04630  서울 중구 소파로 97 (예장동)', '교통 정보': '4호선 명동역 3번 출구에서 약 517m (도보 7분)'}","[{'review': '남산에 들렀다 다른가게들이 대기시간이 너무 길어 방문했습니다. 돈가스랑 그라탕 맛있구요 ㅋㅋ의외로 손님들이 반찬으로 나온 깍두기가 맛있다고 칭찬하더라구요. 기본 스프도 맛있구요. 다른가게에 비해 대기가 안길어 그렇지 여기도 점심시간 아니어도 계속 대기믄 있습니다. 관광지 근처라 가격은 그렇게 저렴하지는 않아요!!', 'score': '5'}, {'review': '남산 돈까스 거리에 있는 집들 중 하나로\nTV쇼 ""무한도전""의 에피소드 장소로 유명한 식당\n\n테이블은 30개 정도로 주변 집에비해 작은 사이즈이나 다른 남산 돈까스집들이 얇고 넓은 느낌의 한국식 돈까스인 반면 이집은 두껍고 치즈를 많이 넣은 요즘 돈까스의 형태라 먹을만 함.\n\n특히 돈까스를 시키면 감자튀김과 샐러드를 함께주는데 싸구려 양배추 샐러드가...', 'score': '4'}]"
연희동칼국수,한여름에도 칼국수만을 고집하는 곳. 열두 시간 우려낸 사골 국물의 칼국수이다. 그 외에 수육도 같이 먹어볼 만하다. 담백한 맛을 좋아하는 사람들에게 추천할 만하다.,"{'전화번호': '02-333-3955', '이용시간': '화요일~일요일 11:00~20:30', '휴무일': '월요일, 명절 휴무', '대표메뉴': '칼국수, 수육', '가격대': '1만원대', '주소': '03703  서울 서대문구 연희맛로 37', '교통 정보': '2호선 홍대입구역 3번 출구에서 약 1.3km (도보 21분)'}","[{'review': '칼국수도 맛있지만 김치가 정말 맛있는 집입니다.\n백김치랑 빨간김치 두가지가 나오는데 양도 푸짐하고 원하면 얼마든지 더 받을 수 있습니다.\n평일에는 굉장히 사람이 많아서 웨이팅 있을 수 있고 주말에는 굉장히 한가합니다.\n사람이 없어도 나오는 시간이 꽤 오래 걸려서 시간 없을때는 가기 어려울듯 합니다.', 'score': '4'}, {'review': '늘 일정한 손님이 있는 곳. 그래도 많이 기다리는 경우는 없음\n백김치가 달달하면서도 시원한 맛\n칼국수는 약간 면이 퍼지는 편.', 'score': '4'}, {'review': '일반 칼국수 보다는 비싼감이 있으나 진한 육수와 깔끔한 백김치가 맛있는 집입니다. 연희동 근처일경우는 한번쯤 다녀오는 것도 좋을 듯 하나 개인적으로 찾아가서 먹진 않을 듯합니다', 'score': '3'}, {'review': '육수로 진하게 맛을 낸 국물이 칼국수의 풍미를 더하는 연희동 대표 맛집입니다.\n\n수육도 맛있으며, 건물을 전부 쓰는 큰 규모에도 불구하고 점심에는 늘 손님이 붐빕니다.\n\n주차도 용이하며 방도 사용 가능하나, 김치와 티슈는 셀프인점, 친절도는 다소 아쉬우며 꾸준한 가격 상승으로 더이상 가성비 좋은 맛집은 아닌점을 참고하시기 바랍니다.', 'score': '4'}, {'review': '식사, 서비스, 주차 전부 다 평균이상을 잘 유지하는 곳입니다. 뭐 하나가 특별해서 난리나는 집치고 오래가는 가게 없습니다만 고르게 안정적으로 수준을 유지하는 집들은 오래오래 가는 노포가 되곤 합니다. 저와 가족들은 칼국수에 백김치 앉어서 먹으러 갑니다. 백김치가 좀 탄산느낌이 있으나 어쩄거나 좋습니다.', 'score': '4'}]"
손칼국수,가정집 방안에 앉아 집에서 만든 듯한 칼국수를 맛볼 수 있다. 사골 국물을 베이스로 한 칼국수에 전을 곁들이면 더욱 좋다. 저녁 6시면 영업을 하지 않으므로 가기 전에 확인이 필요하다.,"{'전화번호': '02-764-7947', '이용시간': '월요일~금요일 12:00~14:00', '휴무일': '주말, 명절 휴무', '운영 요일': '월요일~금요일', '대표메뉴': '칼국수, 생선전, 고추전, 빈대떡', '가격대': '1만원대', '주소': '03076  서울 종로구 혜화로 10-5', '교통 정보': '4호선 혜화역 4번 출구에서 약 393m (도보 5분)'}","[{'review': '사골칼국수로 이만한 곳을 아직까지 만나본 적이 없다. 그리고 처음 방문했을 때부터 지금까지 한결같은 맛이어서 좋다. 국수는 물론 함께 나오는 찬과 김치도 맛갈나다. 전도 맛있지만 적은 인원이 가면 여러 개 시켜먹을 수 없는 것이 아쉽다. \n주인 아주머니의 친절한 미소만으로도 다시 찾고 싶은 집이다. 단, 저녁 늦게 가면 식사가 어려울 수 있으니 먼저...', 'score': '5'}, {'review': '이 동네 수많은 칼국수집 중에서 가장 좋아하는 곳입니다. 깨끗한 사골 칼국수와 김치랑 먹으면 든든하고 맛있게 한끼 해결할 수 있어요. 면발도 부드러우면서 식감이 좋아요.', 'score': '5'}]"
마노디셰프,피자와 파스타를 부담없이 즐길 수 있는 이탈리안 비스트로. 블루베리 피자가 유명하며 먹물로 된 도우에 나오는 고르곤졸라 피자도 독특한 메뉴 중의 하나이다. 와인도 250여 종 갖추고 있어서 와인과 같이 즐기기에도 좋다.,"{'전화번호': '02-561-9011', '웹사이트': 'http://www.manodichef.co.kr/', '이용시간': '평일 11:00 ~ 15:00 / 17:00 ~ 22:00\n토요일 11:00 ~ 15:50 / 17:00 ~ 22:00\n일요일 11:00 ~ 15:50 / 17:00 ~ 21:00', '운영 요일': '매일', '이용요금': '약 2 ~ 6만원대', '대표메뉴': '마노디셰프 품격코스, 봉골레 알리 올리오 파스타, 로제 씨푸드 파스타', '주소': '06169  서울특별시 강남구 테헤란로87길 21 (삼성동)', '교통 정보': '2호선 삼성역 5번 출구에서 약 439m (도보 6분)'}","[{'review': '강남점에 가본 적 있어서 찾아서 갔습니다\n그냥 지나가다가 들리기에는\n좀 애매한 위치에 있다는 생각이...\n\n우선 맛은 좋구요\n가격은 약간 높은 편', 'score': '5'}, {'review': '데이트 소개팅장소로 많이가는곳이에요 가격대는 2만원 스테이크는좀더비싸고요 스테이크피자가인기많습니다 대부분메뉴가괜찮아요', 'score': '4'}, {'review': '가족들과 같이 식사를 했던 곳으로 전반적으로 음식의 맛이 괜찮았다. 하지만 가장 인상적이었던 음식은 블루베리 루꼴라 피자. 블루베리 특유의 상큼함과 수북히 놓여진 루꼴라 덕분에 샐러드를 먹는 듯한 느낌도 난다. 거기에 고소한 호두와 치즈의 맛이 매우 조화로웠다. 계산을 내가 하지 않은 관계로 가격에 대한 감은 잘 없지만 만족스러운 식사였다.', 'score': '4'}, {'review': '룸이 있는 넓은 매장이여서 조용히 식사하기에 좋았다. 쉬림프아보가토 샐러드가 신선하니 아보가토도 적당히 익은게 맛있었다. 흑돼지를 이베리코를 써서 좋은 돼지를 먹었다.', 'score': '4'}, {'review': '코엑스 도심공항 터미널 맞은편 건물 지하에\n숨어있는 식당입니다.  계절에 따라 딸기피자, \n스테이크 피자, 파스타등 메뉴가 다양하고 \n분위기도 괜찮습니다. 봉골레 파스타도 굿...', 'score': '4'}]"
상락원,"도심 속 한국의 멋, 고품격 휴식 공간  잔디밭과 정원이 어우러진 도심 속 고품격 한정식 전문점. 조용하고 넓은 정원, 가정집 같은 분위기에 엄마의 손맛을 느낄 수 있는 포근함이 있는 곳. 산지에서 직송해오는 무공해 재료를 맛깔스런 손맛으로 버무려 전통 한정식의 진가를 높인다.","{'전화번호': '0507-1329-5220', '이용시간': '매일 09:00 ~ 21:00', '휴무일': '명절휴무', '대표메뉴': '청계밥상, 시래기돌솥밥, 돌솥밥, 고등어 정식', '주소': '06806  서울 서초구 원터길 23 (원지동)', '교통 정보': '신분당선 청계산입구역 2번 출구에서 약 618m (도보 8분)'}",[]
마당,"에르메스 도산파크 건물 내의 중심부에 정원이 있고 카페는 그 정원을 둘러싸고 있다. 에르메스의 식기와 소품들을 사용하여 격조 있는 분위기에서 최상의 서빙을 받으면서 식사할 수 있는 품격 있는 공간이다. 마당이라는 이름이 있지만, 에르메스 카페라고도 부른다. 에르메스와 신라호텔이 공동 운영하고 있다.","{'전화번호': '02-546-3643', '이용시간': '월요일~토요일 11:30~01:00 (라스트오더 23:30)\n일요일 11:30~22:00 (라스트오더 20:30)', '운영 요일': '월화수목금토일', '이용요금': '약 2 ~ 5만원대', '대표메뉴': '카페', '가격대': '2만원대', '주소': '06021  서울 강남구 도산대로45길 7 (신사동, 에르메스도산파크)', '교통 정보': '3호선 신사역 8번 출구에서 약 783m (도보 11분)'}","[{'review': '에르메스 도산점 지하에 있는 카페입니다. 에르메스 다운 인테리어와 그릇이 유명해요. 분위기가 너무 고급지고 좋았습니다.', 'score': '4'}, {'review': '에르메스 카페 마당은 분명 맛도 좋고 분위기도 좋지만 가격만큼의 가치가 있는지는 잘 모르겠어요. 다만 담겨나오는 찻잔과 식기가 모두 에르메스이기에 상당히 기분이 좋아요.', 'score': '4'}, {'review': '디올 까페와 쌍대마차를 이루고있는 에르메스 까페 라고 불리는 까페마당, 역시나 에르메스 한국지사 본점 지하에 있다보니 분위기나 식기류나 맛이나 모하나 빠지지않고 맛있었습니다.\n식기류는 모두 에르메스 제품이며 식사와 서비스는 신라호텔에서 제공합니다.\n애프터눈티셋트를 즐기려고 찾았고 대만족!\n14:30부터 가능하며 미리가서 음료부터 즐기는것 또한 가능해서...', 'score': '5'}, {'review': '양파스푸를 단품으로 판매 하는 곳이 잘 없어, 양파스푸가 생각나는 날은 마당에 방문합니다.\n베이커리며 메뉴들이 모두 훌륭합니다.\n식사 뿐만 아니라 디저트 메뉴도 훌륭합니다.\n추천드립니다.', 'score': '5'}, {'review': '여긴 늘 조용하며 에르메스 디쉬들에 우아하게 나온다.가끔 디저트를  먹으러 가도 좋으며 여름엔 애플망고 빙수도 훌륭하다. 비교적 붐비지는 않아도 예약하는편이 안전하다.발렛파킹가능.좌석들이 띠엄띠엄 중정을 중심으로 둘러져있어서 친구들과 조용한 수다가 가능한곳이다', 'score': '5'}]"
